{
  "schema_version": "0.1.0",
  "assessments": [
    {
      "candidate_id": "c1",
      "status": "valid",
      "reason": "The conversion exception escapes the handler in the reviewed source.",
      "evidence": [
        {
          "kind": "code",
          "explanation": "The new endpoint converts untrusted text with int() without handling ValueError.",
          "source_ids": [
            "code-head"
          ],
          "location": {
            "path": "app/views.py",
            "start_line": 21,
            "end_line": 23,
            "side": "RIGHT",
            "revision_role": "head"
          },
          "artifact_id": null
        }
      ],
      "missing_evidence": [],
      "resolution_needed": null,
      "suggestion_assessment": "not_provided",
      "invalid_reason": null
    }
  ],
  "final_replies": [
    {
      "finding_id": "finding-11111111-1111-4111-8111-111111111111",
      "source_comment_ids": [
        "author-reply"
      ],
      "body": "The route accepts text in this reviewed snapshot; the conversion still raises ValueError for invalid identifiers. The finding remains open.",
      "reply_target_id": "reply-finding-11111111-1111-4111-8111-111111111111"
    },
    {
      "finding_id": "finding-11111111-1111-4111-8111-111111111111",
      "source_comment_ids": [
        "second-author-reply"
      ],
      "body": "Yes. Direct calls in this snapshot also reach the unchecked conversion; the finding remains valid.",
      "reply_target_id": "reply-second-thread"
    }
  ],
  "closure_assessments": []
}
