{
  "schema_version": "0.1.0",
  "assessments": [
    {
      "candidate_id": "c1",
      "status": "valid",
      "reason": "The conversion exception escapes the handler in the reviewed source.",
      "evidence": [
        {
          "kind": "code",
          "explanation": "The new endpoint converts untrusted text with int() without handling ValueError.",
          "source_ids": [
            "code-head"
          ],
          "location": {
            "path": "app/views.py",
            "start_line": 21,
            "end_line": 23,
            "side": "RIGHT",
            "revision_role": "head"
          },
          "artifact_id": null
        }
      ],
      "missing_evidence": [],
      "resolution_needed": null,
      "suggestion_assessment": "not_provided",
      "invalid_reason": null
    }
  ],
  "final_replies": [],
  "closure_assessments": [
    {
      "finding_id": "finding-11111111-1111-4111-8111-111111111111",
      "relevant_change_confirmed": true,
      "reason": "The new caller reaches the conversion without the validation on which dismissal relied.",
      "evidence": [
        {
          "kind": "code",
          "explanation": "A new caller in app/routes.py bypasses validation assumed by the dismissal; the original handler file is unchanged.",
          "source_ids": [
            "code-head"
          ],
          "location": {
            "path": "app/routes.py",
            "start_line": 10,
            "end_line": 12,
            "side": "RIGHT",
            "revision_role": "head"
          },
          "artifact_id": null
        }
      ]
    }
  ]
}
